{
  "$schema": "./litespec/schemas/ui-source-lock.schema.json",
  "schemaVersion": 1,
  "generator": "shadcn/ui",
  "cli": "4.21.5",
  "preset": {
    "style": "nova",
    "base": "base-ui",
    "cssVariables": true,
    "baseColor": "neutral",
    "theme": "neutral",
    "chartColor": "neutral",
    "font": "geist",
    "fontHeading": "inherit",
    "icons": "lucide",
    "radius": "default",
    "menuAccent": "subtle",
    "menuColor": "default",
    "componentsStyle": "base-nova"
  },
  "registry": {
    "name": "shadcn",
    "url": "https://ui.shadcn.com"
  },
  "formatter": "default",
  "components": [
    {
      "name": "button",
      "address": "button",
      "status": "baseline",
      "paths": ["src/components/button.tsx"],
      "digest": "sha256:0000000000000000000000000000000000000000000000000000000000000000",
      "dependencies": ["@base-ui/react", "class-variance-authority", "cn"]
    },
    {
      "name": "skeleton",
      "address": "skeleton",
      "status": "baseline",
      "paths": ["src/components/skeleton.tsx"],
      "digest": "sha256:0000000000000000000000000000000000000000000000000000000000000000",
      "dependencies": []
    }
  ]
}